{
  "case_id": "CG-2026-000123",
  "passenger_id": "pax_8842",
  "category": "security",
  "department": "RPF",
  "channel": "railmadad",
  "external_reference": "RM-77f3a1",
  "summary": "Passenger reports an unattended bag in coach B4 of 12301.",
  "language": "hi",
  "input_mode": "speech",
  "transcript": "B4 coach mein ek lawaris bag pada hai",
  "status": "open",
  "created_at": "2026-06-12T07:10:00+05:30",
  "updated_at": "2026-06-12T07:10:05+05:30",
  "history": [
    { "at": "2026-06-12T07:10:00+05:30", "status": "open", "note": "case created from helpline" }
  ]
}
